id,text
1037173907625832448,"The already discredited Woodward book, so many lies and phony sources, has me calling Jeff Sessions “mentally retarded” and “a dumb southerner.” I said NEITHER, never used those terms on anyone, including Jeff, and being a southerner is a GREAT thing. He made this up to divide!"
1037171035152506880,"Sleepy Eyes Chuck Todd of Fake NBC News said it’s time for the Press to stop complaining and to start fighting back. Actually Chuck, they’ve been doing that from the day I announced for President. They’ve gone all out, and I WON, and now they’re going CRAZY!"
1037117638101688320,"The Woodward book has already been refuted and discredited by General (Secretary of Defense) James Mattis and General (Chief of Staff) John Kelly. Their quotes were made up frauds, a con on the public. Likewise other stories and quotes. Woodward is a Dem operative? Notice timing?"
1037083839238164486,“Judge Brett Kavanaugh is an Exceptionally Qualified and Deserving Nominee for the Supreme Court” https://t.co/nD5XZo9yIm
1037081791599915008,"Paul Cook is a decorated Marine Corps Veteran who loves and supports our Military and Vets. He is Strong on Crime, the Border, and supported Tax Cuts for the people of California. Paul has my total and complete Endorsement!"
1037079053784821766,“Pledge to America’s Workers” https://t.co/wbGZU6oi9G
1037078254845390849,....looking to inflict pain and embarrassment to one of the most highly renowned jurists to ever appear before Congress. So sad to see!
1037078251095687174,"The Brett Kavanaugh hearings for the future Justice of the Supreme Court are truly a display of how mean, angry, and despicable the other side is. They will say anything, and are only...."
1037077962632450050,"Jon Kyl will be an extraordinary Senator representing an extraordinary state, Arizona. I look forward to working with him!"
1037043834482552832,Everyone in the path of #Gordon please heed the advice of State and local officials and follow @NHC_Atlantic for updates. The Federal Government stands ready to assist. Be safe! https://t.co/sJiL4wnQID
1036991866124861440,"NBC FAKE NEWS, which is under intense scrutiny over their killing the Harvey Weinstein story, is now fumbling around making excuses for their probably highly unethical conduct. I have long criticized NBC and their journalistic standards-worse than even CNN. Look at their license?"
1036740691211284480,President Bashar al-Assad of Syria must not recklessly attack Idlib Province. The Russians and Iranians would be making a grave humanitarian mistake to take part in this potential human tragedy. Hundreds of thousands of people could be killed. Don’t let that happen!
1036695682072158214,"According to the Failing New York Times, the FBI started a major effort to flip Putin loyalists in 2014-2016. “It wasn’t about Trump, he wasn’t even close to a candidate yet.”  Rigged Witch Hunt!"
1036689178749227008,"I see that John Kerry, the father of the now terminated Iran deal, is thinking of running for President. I should only be so lucky - although the field that is currently assembling looks really good - FOR ME!"
1036685082650705920,"....The Democrats, none of whom voted for Jeff Sessions, must love him now. Same thing with Lyin’ James Comey. The Dems all hated him, wanted him out, thought he was disgusting - UNTIL I FIRED HIM! Immediately he became a wonderful man, a saint like figure in fact. Really sick!"
1036681588573130752,"Two long running, Obama era, investigations of  two very popular Republican Congressmen were brought to a well publicized charge, just ahead of the Mid-Terms, by the Jeff Sessions Justice Department. Two easy wins now in doubt because there is not enough time. Good job Jeff......"
1036672676801196036,The U.S. is respected again! https://t.co/NtQ4vsoqnk
1036637078640058368,"Richard Trumka, the head of the AFL-CIO, represented his union poorly on television this weekend. Some of the things he said were so against the working men and women of our country, and the success of the U.S. itself, that it is easy to see why unions are doing so poorly. A Dem!"
1036590520649306113,The Worker in America is doing better than ever before. Celebrate Labor Day!
1036576599771111424,Happy Labor Day! Our country is doing better than ever before with unemployment setting record lows. The U.S. has tremendous upside potential as we go about fixing some of the worst Trade Deals ever made by any country in the world. Big progress being made!
1036246829560680454,"....The fact is that African/American unemployment is now the lowest in the history of our country. Same with Asian, Hispanic and almost every other group. The Democrats have been all talk and no action. My Administration has already produced like no other, and everyone sees it!"
1036244434164310016,"Tiger Woods showed great class in the way he answered the question about the Office of the Presidency and me. Now they say the so-called “left” is angry at him. So sad, but the “center &amp; right” loves Tiger, Kanye, George Foreman, Jim Brown &amp; so many other greats, even more......."
1036061566628757504,"“There is no possible way the Trump Tower meeting between Don Trump jr and a couple of Russians, who have very deep connections to both the Clintons &amp; Fusion GPS, &amp; where no information on the Clintons was exchanged, is a crime. Dems are blinded by their hatred of Trump.” Bongino"
1036056454954995712,"“No information was ever given by the Trump Team to Russia, yet the Hillary Clinton campaign paid for information from Kremlin sources and just washed it through an intermediary, Christopher Steele.”  Jesse Waters"
1036054534450229250,"....positions of power. That’s part of the story of the Russia Hoax. Christopher Steele is on the payroll of Hillary Clinton &amp; the FBI, &amp; when they fired him for lying, they continued to use him. Violation of FBI regulations. Kept trying to verify the unverifiable.” @GreggJarrett"
1036052758389051392,"“There’s no fairness here, if you’re a Democrat or a friend of Hillary you get immunity or off scott free. If you’re connected to Donald Trump, you get people like Robert Mueller &amp; Andrew Weissman, and his team of partisans, coming after you with a vengeance and abusing their...."
1036024775154565120,We shouldn’t have to buy our friends with bad Trade Deals and Free Military Protection!
1036024180087644160,MAKE AMERICA GREAT AGAIN!
1036023767489814528,No Deal! Trade Talks with Canada Conclude for the Week with No Agreement | Breitbart https://t.co/87vi7OqopY via @BreitbartNews
1035908242277376001,"....Remember, NAFTA was one of the WORST Trade Deals ever made. The U.S. lost thousands of businesses and millions of jobs. We were far better off before NAFTA - should never have been signed. Even the Vat Tax was not accounted for. We make new deal or go back to pre-NAFTA!"
1035905988682018816,"There is no political necessity to keep Canada in the new NAFTA deal. If we don’t make a fair deal for the U.S. after decades of abuse, Canada will be out. Congress should not interfere w/ these negotiations or I will simply terminate NAFTA entirely &amp; we will be far better off..."
1035881733898547201,"....Donald Trump, and now we find out that there wasn’t even a hearing - that Donald Trump’s 4th Amendment right to privacy was signed away...and someone in there is swearing that this stuff is true, when it wasn’t? This is the scandal here - a police state.”  Dan Bongino"
1035879783547199488,"“You have a Fake Dossier, gathered by Steele, paid by the Clinton team to get information on Trump. The Dossier is Fake, nothing in it has been verified. It then filters into our American court system in order to spy on Barrack Obama and Hillary Clinton’s political opponent......"
1035868119884021760,....of the DOJ &amp; FBI are completely out to lunch in terms of exposing and holding those accountable who are responsible for that corruption.” @TomFitton @JudicialWatch
1035866602623979526,"Report: There were no FISA hearings held over Spy documents.”It is astonishing that the FISA courts couldn’t hold hearings on Spy Warrants targeting Donald Trump. It isn’t about Carter Page, it’s about the Trump Campaign. You’ve got corruption at the DOJ &amp; FBI. The leadership...."
1035850173224824832,"I love Canada, but they’ve taken advantage of our Country for many years!"
1035849517873201157,“I think today what has happened is that news reporting has become part of the adversary system.” Alan Dershowitz  It has become tainted and corrupt! DJT
1035718986871320577,Still can’t believe that Bloomberg violated a firm OFF THE RECORD statement. Will they put out an apology?
1035718119459893250,Great day in North Carolina where Republicans will do very well!
1035717747936768000,"The ABC/Washington Post Poll was by far the least accurate one 2 weeks out from the 2016 Election. I call it a suppression poll - but by Election Day they brought us, out of shame, to about even. They will never learn!"
1035715271418413056,.@Rasmussen_Poll just came out at 48% approval rate despite the constant and intense Fake News. Higher than Election Day and higher than President Obama. Rasmussen was one of the most accurate Election Day polls!
1035650292782653441,“President Donald J. Trump is Strengthening Retirement Security for American Workers” https://t.co/cKeATuKXDe
1035597354395680774,"Wow, I made OFF THE RECORD COMMENTS to Bloomberg concerning Canada, and this powerful understanding was BLATANTLY VIOLATED. Oh well, just more dishonest reporting. I am used to it. At least Canada knows where I stand!"
1035575198169411584,"I will be doing a major rally for Senator Ted Cruz in October. I’m picking the biggest stadium in Texas we can find. As you know, Ted has my complete and total Endorsement. His opponent is a disaster for Texas - weak on Second Amendment, Crime, Borders, Military, and Vets!"
1035344085798801408,"Thank you Indiana, I love you!
https://t.co/To6s9ViMj1"
1035233203609657344,"Kevin Stitt ran a great winning campaign against a very tough opponent in Oklahoma. Kevin is a very successful businessman who will be a fantastic Governor. He is strong on Crime &amp; Borders, the 2nd Amendment, &amp; loves our Military &amp; Vets. He has my complete and total Endorsement!"
1035209068095434752,CNN is working frantically to find their “source.” Look hard because it doesn’t exist. Whatever was left of CNN’s credibility is now gone!
1035162684633825286,"Will be going to Evansville, Indiana, tonight for a big crowd rally with Mike Braun, a very successful businessman who is campaigning to be Indiana’s next U.S. Senator. He is strong on Crime &amp; Borders, the 2nd Amendment, and loves our Military &amp; Vets. Will be a big night!"
1035159956507566080,"I am very excited about the person who will be taking the place of Don McGahn as White House Counsel! I liked Don, but he was NOT responsible for me not firing Bob Mueller or Jeff Sessions. So much Fake Reporting and Fake News!"
1035154621357064192,"The Rigged Russia Witch Hunt did not come into play, even a little bit, with respect to my decision on Don McGahn!"
1035148684432953346,"Wow, Nellie Ohr, Bruce Ohr’s wife, is a Russia expert who is fluent in Russian. She worked for Fusion GPS where she was paid a lot. Collusion! Bruce was a boss at the Department of Justice and is, unbelievably, still there!"
1035134150590783489,The only thing James Comey ever got right was when he said that President Trump was not under investigation!
1035131133997068288,"Ivanka Trump &amp; Jared Kushner had NOTHING to do with the so called “pushing out” of Don McGahn.The Fake News Media has it, purposely,so wrong! They love to portray chaos in the White House when they know that chaos doesn’t exist-just a “smooth running machine” with changing parts!"
1035125176617365504,"The news from the Financial Markets is even better than anticipated. For all of you that have made a fortune in the markets, or seen your 401k’s rise beyond your wildest expectations, more good news is coming!"
1035122954697433088,"I just cannot state strongly enough how totally dishonest much of the Media is. Truth doesn’t matter to them, they only have their hatred &amp; agenda. This includes fake books, which come out about me all the time, always anonymous sources, and are pure fiction. Enemy of the People!"
1035120511259500544,"What’s going on at @CNN is happening, to different degrees, at other networks - with @NBCNews being the worst. The good news is that Andy Lack(y) is about to be fired(?) for incompetence, and much worse. When Lester Holt got caught fudging my tape on Russia, they were hurt badly!"
1035117507839967232,"The hatred and extreme bias of me by @CNN has clouded their thinking and made them unable to function. But actually, as I have always said, this has been going on for a long time. Little Jeff Z has done a terrible job, his ratings suck, &amp; AT&amp;T should fire him to save credibility!"
1034990940593823746,Watch: Kanye West Says Trump Wants to Be the ‘Greatest President’ for Black Americans https://t.co/ECxTzVNZeG via @BreitbartNews
1034981992692166658,"...charge of the FISA court. He should direct the Presiding Judge, Rosemary Collier, to hold a hearing, haul all of these people from the DOJ &amp; FBI in there, &amp; if she finds there were crimes committed, and there were, there should be a criminal referral by her....” @GreggJarrett"
1034979892524457985,"“Ohr told the FBI it (the Fake Dossier) wasn’t true, it was a lie and the FBI was determined to use it anyway to damage Trump and to perpetrate a fraud on the court to spy on the Trump campaign. This is a fraud on the court. The Chief Justice of the U.S. Supreme Court is in......"
1034965029676883970,"“Lanny Davis admits being anonymous source in CNN Report.” @BretBaier  Oh well, so much for CNN saying it wasn’t Lanny. No wonder their ratings are so low, it’s FAKE NEWS!"
1034934675972792320,"CNN is being torn apart from within based on their being caught in a major lie and refusing to admit the mistake. Sloppy @carlbernstein, a man who lives in the past and thinks like a degenerate fool, making up story after story, is being laughed at all over the country! Fake News"
1034914379391807488,"...differences, they will be resolved in time by President Trump and China’s great President Xi Jinping. Their relationship and bond remain very strong."
1034914377768620037,"...of money on joint U.S.-South Korea war games. Besides, the President can instantly start the joint exercises again with South Korea, and Japan, if he so chooses. If he does, they will be far bigger than ever before. As for the U.S.–China trade disputes, and other..."
1034914376141168640,"...considerable aid, including money, fuel, fertilizer and various other commodities. This is not helpful! Nonetheless, the President believes that his relationship with Kim Jong Un is a very good and warm one, and there is no reason at this time to be spending large amounts..."
1034914371099676674,"STATEMENT FROM THE WHITE HOUSE

President Donald J. Trump feels strongly that North Korea is under tremendous pressure from China because of our major trade disputes with the Chinese Government. At the same time, we also know that China is providing North Korea with..."
1034821067423014913,How the hell is Bruce Ohr still employed at the Justice Department? Disgraceful!  Witch Hunt!
1034817106632761344,"Consumer Confidence Index, just out, is the HIGHEST IN 18 YEARS! Also, GDP revised upward to 4.2 from 4.1. Our country is doing great!"
1034810550025433090,"White House Counsel Don McGahn will be leaving his position in the fall, shortly after the confirmation (hopefully) of Judge Brett Kavanaugh to the United States Supreme Court. I have worked with Don for a long time and truly appreciate his service!"
1034785759377727490,"Martha McSally is an extraordinary woman. She was a very talented fighter jet pilot and is now a highly respected member of Congress. She is Strong on Crime, the Border and our  under siege 2nd Amendment. Loves our Military and our Vets. Has my total and complete Endorsement!"
1034783131855998976,"When you see “anonymous source,” stop reading the story, it is fiction!"
1034782741714399232,“Anonymous Sources are really starting to BURN the media.” @FoxNews The fact is that many anonymous sources don’t even exist. They are fiction made up by the Fake News reporters. Look at the lie that Fake CNN is now in. They got caught red handed! Enemy of the People!
1034778515789545473,"Big Election Wins last night! The Republican Party will MAKE AMERICA GREAT AGAIN! Actually, it is happening faster than anybody thought possible! It is morphing into KEEP AMERICA GREAT!"
1034777225336369152,“Hillary Clinton and the DNC paid for information from the Russian government to use against her government - there’s no doubt about that!” @TuckerCarlson
1034775835004358656,“The Obama people did something that’s never been done...They spied on a rival presidential campaign. Would it be OK if Trump did it next? I am losing faith that our system is on the level. I’m beginning to think it is rotten &amp; corrupt. Scary stuff Obama did.” @TuckerCarlson  DOJ
1034772809350885376,"Not only did Congressman Ron DeSantis easily win the Republican Primary, but his opponent in November is his biggest dream....a failed Socialist Mayor named Andrew Gillum who has allowed crime &amp; many other problems to flourish in his city. This is not what Florida wants or needs!"
1034663158357655552,"Martha McSally, running in the Arizona Primary for U.S. Senate, was endorsed by rejected Senator Jeff Flake....and turned it down - a first! Now Martha, a great U.S. Military fighter jet pilot and highly respected member of Congress, WINS BIG. Congratulations, and on to November!"
1034654816046329856,"Hillary Clinton’s Emails, many of which are Classified Information, got hacked by China. Next move better be by the FBI &amp; DOJ or, after all of their other missteps (Comey, McCabe, Strzok, Page, Ohr, FISA, Dirty Dossier etc.), their credibility will be forever gone!"
1034628350986338308,New Poll - A majority of Americans think that John Brennan and James Comey should have their Security Clearances Revoked. Not surprised! @FoxNews
1034626683066826753,"Our new Trade Deal with Mexico focuses on FARMERS, GROWTH for our country, tearing down TRADE BARRIERS, JOBS and having companies continue to POUR BACK INTO OUR COUNTRY. It will be a big hit!"
1034612092253470721,Add the 2026 World Cup to our long list of accomplishments!
1034610829860261895,"Report just out: “China hacked Hillary Clinton’s private Email Server.” Are they sure it wasn’t Russia (just kidding!)? What are the odds that the FBI and DOJ are right on top of this? Actually, a very big story. Much classified information!"
1034603586817339392,Congratulations to Governor Rick Scott of Florida on his conclusive Republican Primary Win. He will be a great Senator!
1034599532787630080,Such a fantastic win for Ron DeSantis and the people of the Great State of Florida. Ron will be a fantastic Governor. On to November!
1034492929153359872,“Consumer confidence pops in August to highest level since October 2000” https://t.co/1Gg5IOtbNa
1034456281120206848,"....results on “Trump News” are from National Left-Wing Media, very dangerous. Google &amp; others are suppressing voices of Conservatives and hiding information and news that is good. They are controlling what we can &amp; cannot see. This is a very serious situation-will be addressed!"
1034456273306243076,"Google search results for “Trump News” shows only the viewing/reporting of Fake News Media. In other words, they have it RIGGED, for me &amp; others, so that almost all stories &amp; news is BAD. Fake CNN is prominent. Republican/Conservative &amp; Fair Media is shut out. Illegal? 96% of...."
1034445783876161536,I smile at Senators and others talking about how good free trade is for the U.S. What they don’t say is that we lose Jobs and over 800 Billion Dollars a year on really dumb Trade Deals....and these same countries Tariff us to death. These lawmakers are just fine with this!
1034379525113753601,NASDAQ has just gone above 8000 for the first time in history!
1034378693370630145,“President Trump has done more for minority groups in this country than any president in decades.”  @LouDobbs
1034248860116430848,VOTE FOR RON! https://t.co/80NShvQ73u
1034128943480299521,"Governor Doug Ducey of Arizona is doing a great job. It would be really nice to show your support tomorrow by voting for him in Tuesdays Primary. Doug is strong on Crime, the Border, and our Second Amendment. Loves our Military &amp; our Vets. He has my full and complete Endorsement."
1034128472946434056,"Congressman Ron DeSantis is a special person who has done an incredible job. He is running in Tuesdays Primary for Governor of Florida….Strong on Crime, Borders and wants Low Taxes. He will be a great Governor and has my full and total Endorsement!"
1034128239579549696,"Rick Scott of Florida is doing a fantastic job as Governor. Jobs are pouring into the State and its economic health is better than ever before. He is strong on Crime, Borders, and loves our Military and Vets. Vote for Rick on Tuesday!"
1034072800041099265,A big deal looking good with Mexico!
1034072454086447104,"The Fake News Media worked hard to get Tiger Woods to say something that he didn’t want to say. Tiger wouldn’t play the game - he is very smart. More importantly, he is playing great golf again!"
1034062375941550081,"Thank you to the great @JimBrownNFL32, perhaps the greatest running back of all time, for your wonderful words and support. Since our meeting in New York, African-American UNEMPLOYMENT has reached the LOWEST LEVEL IN HISTORY. You get it!"
1033876658439245825,Over 90% approval rating for your all time favorite (I hope) President within the Republican Party and 52% overall. This despite all of the made up stories by the Fake News Media trying endlessly to make me look as bad and evil as possible. Look at the real villains please!
1033836873473568768,"“Mainstream Media tries to rewrite history to credit Obama for Trump accomplishments. Since President Trump took office, the economy is booming. The stronger the economy gets, the more desperate his critics are. O had weakest recovery since Great Depression.” @WashTimes"
1033723516116500481,Fantastic numbers on consumer spending released on Friday. Stock Market hits all time high!
1033722550881329152,"...And it will get, as I have always said, much better from even here! https://t.co/El26RzBjpG"
1033515425336885248,My deepest sympathies and respect go out to the family of Senator John McCain. Our hearts and prayers are with you!
1033500723709992960,Stock Market hit all time high on Friday. Congratulations U.S.A.!
1033343857675644928,"Our relationship with Mexico is getting closer by the hour. Some really good people within both the new and old government, and all working closely together....A big Trade Agreement with Mexico could be happening soon!"
1033341788491317255,“The FBI looked at less than 1%” of Crooked’s Emails!
1033341088579440640,"“The FBI only looked at 3000 of 675,000 Crooked Hillary Clinton Emails.” They purposely didn’t look at the disasters. This news is just out. @FoxNews"
1033339636343549952,"Big story out that the FBI ignored tens of thousands of Crooked Hillary Emails, many of which are REALLY BAD. Also gave false election info. I feel sure that we will soon be getting to the bottom of all of this corruption. At some point I may have to get involved!"
1033334753003536384,".@LindseyGrahamSC  “Every President deserves an Attorney General they have confidence in. I believe every President has a right to their Cabinet, these are not lifetime appointments. You serve at the pleasure of the President.”"
1033332301579661312,Jeff Sessions said he wouldn’t allow politics to influence him only because he doesn’t understand what is happening underneath his command position. Highly conflicted Bob Mueller and his gang of 17 Angry Dems are having a field day as real corruption goes untouched. No Collusion!
1033327353227882496,"Michaels Cohen’s attorney clarified the record, saying his client does not know if President Trump knew about the Trump Tower meeting (out of which came nothing!). The answer is that I did NOT know about the meeting. Just another phony story by the Fake News Media!"
1033196105159372800,"Happy birthday Vince, you are truly one of the greats! https://t.co/b8zV5MfojY"
1033175432651321345,"Great #StateDinner2018 in Ohio tonight! Together, we are MAKING AMERICA GREAT AGAIN! https://t.co/ALU1PHEsvh"
1033152062203342850,"Great to see the Senate working on solutions to end the secrecy around ridiculously high drug prices, something I called for in my drug pricing Blueprint. Will now work with the House to help American patients! #AmericanPatientsFirst"
1033148759084093440,Congratulations to new Australian Prime Minister Scott Morrison. There are no greater friends than the United States and Australia!
1033133359185055745,Thank you. I love you Ohio! https://t.co/RQ9Gj0SETz
1033045280143355904,"...Secretary Pompeo looks forward to going to North Korea in the near future, most likely after our Trading relationship with China is resolved. In the meantime I would like to send my warmest regards and respect to Chairman Kim. I look forward to seeing him soon!"
1033045274866999297,"...Additionally, because of our much tougher Trading stance with China, I do not believe they are helping with the process of denuclearization as they once were (despite the UN Sanctions which are in place)..."
