id,text
1067151249668214793,"....starts today, election is on December 4th. @VoteBradRaff is tough on Crime and Borders, Loves our Military and Vets. He will be great for jobs!"
1067151248040824833,Brad Raffensperger will be a fantastic Secretary of State for Georgia - will work closely with @BrianKempGA. It is really important that you get out and vote for Brad - early voting....
1067142820388052993,"....and false way. Something has to be done, including the possibility of the United States starting our own Worldwide Network to show the World the way we really are, GREAT!"
1067142819008122885,"While CNN doesn’t do great in the United States based on ratings, outside of the U.S. they have very little competition. Throughout the world, CNN has a powerful voice portraying the United States in an unfair...."
1067142262545674240,"On the ten-year anniversary of the Mumbai terror attack, the U.S. stands with the people of India in their quest for justice. The attack killed 166 innocents, including six Americans. We will never let terrorists win, or even come close to winning!"
1067066584882126848,"....hundreds of people closely involved with my campaign who never met, saw or spoke to a Russian during this period? So many campaign workers, people inside from the beginning, ask me why they have not been called (they want to be). There was NO Collusion &amp; Mueller knows it!"
1067063727994884096,"When Mueller does his final report, will he be covering all of his conflicts of interest in a preamble, will he be recommending action on all of the crimes of many kinds from those “on the other side”(whatever happened to Podesta?), and will he be putting in statements from....."
1067015026995879937,"Mexico should move the flag waving Migrants, many of whom are stone cold criminals, back to their countries. Do it by plane, do it by bus, do it anyway you want, but they are NOT coming into the U.S.A. We will close the Border permanently if need be. Congress, fund the WALL!"
1066876053170339840,"....children from parents, as did Bush etc., because that is the policy and law. I tried to keep them together but the problem is, when you do that, vast numbers of additional people storm the Border. So with Obama seperation is fine, but with Trump it’s not. Fake 60 Minutes!"
1066873981293260801,".@60Minutes did a phony story about child separation when they know we had the exact same policy as the Obama Administration. In fact a picture of children in jails was used by other Fake Media to show how bad (cruel) we are, but it was in 2014 during O years. Obama separated...."
1066793504804913152,Clinton Foundation donations drop 42% - which shows that they illegally played the power game. They monetized their political influence through the Foundation. “During her tenure the State Department was put in the service of the Clinton Foundation.”  Andrew McCarthy
1066790517944606721,"Europe has to pay their fair share for Military Protection. The European Union, for many years, has taken advantage of us on Trade, and then they don’t live up to their Military commitment through NATO. Things must change fast!"
1066788767133040640,"General Anthony Tata: “President Trump is a man of his word &amp; he said he was going to be tough on the Border, and he is tough on the Border. He has rightfully strengthened the Border in the face of an unprecedented threat. It’s the right move by President Trump.” Thanks General!"
1066786854643662848,"Mississippi, Vote for @cindyhydesmith on Tuesday. Respected by all. We need her in Washington!. Thanks!"
1066689688600281088,"So great that oil prices are falling (thank you President T). Add that, which is like a big Tax Cut, to our other good Economic news. Inflation down (are you listening Fed)!"
1066685057648214018,"Would be very SMART if Mexico would stop the Caravans long before they get to our Southern Border, or if originating countries would not let them form (it is a way they get certain people out of their country and dump in U.S. No longer). Dems created this problem. No crossings!"
1066682146683846657,The large and violent French protests don’t take into account how badly the United States has been treated on Trade by the European Union or on fair and reasonable payments for our GREAT military protection. Both of these topics must be remedied soon.
1066670550708301824,"I will be in Gulfport and Tupelo, Mississippi, on Monday night doing two Rallies for Senator Hyde-Smith, who has a very important Election on Tuesday. She is an outstanding person who is strong on the Border, Crime, Military, our great Vets, Healthcare &amp; the 2nd A. Needed in D.C."
1066665948193669120,Victor Davis Hanson was a very good and interesting guest of Mark Levin on @FoxNews. He wrote a highly touted book called “The Second World Wars” and a new book will soon be coming out called “The Case For Trump.” Recommend both. @marklevinshow
1066480700046655488,"....All will stay in Mexico. If for any reason it becomes necessary, we will CLOSE our Southern Border. There is no way that the United States will, after decades of abuse, put up with this costly and dangerous situation anymore!"
1066478927143677952,Migrants at the Southern Border will not be allowed into the United States until their claims are individually approved in court. We only will allow those who come into our Country legally. Other than that our very strong policy is Catch and Detain. No “Releasing” into the U.S...
1066116263649382400,"I am extremely happy and proud of the job being done by @USTreasury Secretary @StevenMnuchin1. The FAKE NEWS likes to write stories to the contrary, quoting phony sources or jealous people, but they aren’t true. They never like to ask me for a quote b/c it would kill their story."
1066017112425185280,"Really good Criminal Justice Reform has a true shot at major bipartisan support. @senatemajldr Mitch McConnell and @SenSchumer have a real chance to do something so badly needed in our country. Already passed, with big vote, in House. Would be a major victory for ALL!"
1065948536498544640,"Republicans and Democrats MUST come together, finally, with a major Border Security package, which will include funding for the Wall. After 40 years of talk, it is finally time for action. Fix the Border, for once and for all, NOW!"
1065743662464802817,"Our highly trained security professionals are not allowed to do their job on the Border because of the Judicial Activism and Interference by the 9th Circuit. Nevertheless, they are working hard to make America a safer place, though hard to do when anybody filing a lawsuit wins!"
1065718109624066049,"This is the coldest weather in the history of the Thanksgiving Day Parade in NYC, and one of the coldest Thanksgivings on record!"
1065601413189984256,"Will be speaking with our great military in different parts of the world, through teleconference, at 9:00 A.M. Eastern. Then it will be off to see our Coast Guard patriots &amp; to thank them for the great job they have been doing, especially with the hurricanes. Happy Thanksgiving!"
1065583286188158976,"....and Safety at the Border, or anywhere else. They know nothing about it and are making our Country unsafe. Our great Law Enforcement professionals MUST BE ALLOWED TO DO THEIR JOB! If not there will be only bedlam, chaos, injury and death. We want the Constitution as written!"
1065581119242940416,"Justice Roberts can say what he wants, but the 9th Circuit is a complete &amp; total disaster. It is out of control, has a horrible reputation, is overturned more than any Circuit in the Country, 79%, &amp; is used to get an almost guaranteed result. Judges must not Legislate Security..."
1065576088779272192,HAPPY THANKSGIVING TO ALL!
1065575219576926208,"“It’s a mean &amp; nasty world out there, the Middle East in particular. This is a long and historic commitment, &amp; one that is absolutely vital to America’s national security.” @SecPompeo  I agree 100%. In addition, many Billions of Dollars of purchases made in U.S., big Jobs &amp; Oil!"
1065403512559992832,"You just can’t win with the Fake News Media. A big story today is that because I have pushed so hard and gotten Gasoline Prices so low, more people are driving and I have caused traffic jams throughout our Great Nation. Sorry everyone!"
1065400254151954432,Brutal and Extended Cold Blast could shatter ALL RECORDS - Whatever happened to Global Warming?
1065368645021388800,"“79% of these decisions have been overturned in the 9th Circuit.” @FoxNews  A terrible, costly and dangerous disgrace. It has become a dumping ground for certain lawyers looking for easy wins and delays. Much talk over dividing up the 9th Circuit into 2 or 3 Circuits. Too big!"
1065359825654169600,"There are a lot of CRIMINALS in the Caravan. We will stop them. Catch and Detain! Judicial Activism, by people who know nothing about security and the safety of our citizens, is putting our country in great danger. Not good!"
1065357030985252865,"“Thank you to President Trump on the Border. No American President has ever done this before.” Hector Garza, National Border Patrol Council"
1065351478347530241,".....are so many opposing view (on Border and Safety) cases filed there, and why are a vast number of those cases overturned. Please study the numbers, they are shocking. We need protection and security - these rulings are making our country unsafe! Very dangerous and unwise!"
1065346909362143232,"Sorry Chief Justice John Roberts, but you do indeed have “Obama judges,” and they have a much different point of view than the people who are charged with the safety of our country. It would be great if the 9th Circuit was indeed an “independent judiciary,” but if it is why......"
1065261943202738178,"Great new book out, “Mad Politics: Keeping Your Sanity in a World Gone Crazy” by @RealDrGina Loudon. Go out and get your copy today — a great read!"
1065247567443869696,"“‘Trump Imitation Syndrome’ is afflicting the president’s liberal enemies” 

Thank you @MGoodwin_NYPost! https://t.co/KpmsrKCaBZ"
1065225940836458496,MAKE AMERICA GREAT AGAIN!
1065225779825598465,"Oil prices getting lower. Great! Like a big Tax Cut for America and the World. Enjoy! $54, was just $82. Thank you to Saudi Arabia, but let’s go lower!"
1065102519188275201,AMERICA FIRST!
1065088330969305089,"So-called comedian Michelle Wolf bombed so badly last year at the White House Correspondents’ Dinner that this year, for the first time in decades, they will have an author instead of a comedian. Good first step in comeback of a dying evening and tradition! Maybe I will go?"
1064734907941994497,I hope the discovery and eventual recovery of the Argentine submarine San Juan brings needed closure to the wonderful families of those brave missing sailors. I look forward to hearing more from my friend President @MauricioMacri in Argentina later this month.
1064544156960387072,"....We no longer pay Pakistan the $Billions because they would take our money and do nothing for us, Bin Laden being a prime example, Afghanistan being another. They were just one of many countries that take from the United States without giving anything in return. That’s ENDING!"
1064540462848098304,Of course we should have captured Osama Bin Laden long before we did. I pointed him out in my book just BEFORE the attack on the World Trade Center. President Clinton famously missed his shot. We paid Pakistan Billions of Dollars &amp; they never told us he was living there. Fools!..
1064526362994778113,.@cindyhydesmith loves Mississippi and our Great U.S.A. https://t.co/hQPC4CrhDi
1064246787161145346,From day one Rick Scott never wavered. He was a great Governor and will be even a greater Senator in representing the People of Florida. Congratulations to Rick on having waged such a courageous and successful campaign!
1064245710747590657,"Catch and Release is an obsolete term. It is now Catch and Detain. Illegal Immigrants trying to come into the U.S.A., often proudly flying the flag of their nation as they ask for U.S. Asylum, will be detained or turned away. Dems must approve Border Security &amp; Wall NOW!"
1064227483187318784,"The Mayor of Tijuana, Mexico, just stated that “the City is ill-prepared to handle this many migrants, the backlog could last 6 months.” Likewise, the U.S. is ill-prepared for this invasion, and will not stand for it. They are causing crime and big problems in Mexico. Go home!"
1064216956679716864,"So funny to see little Adam Schitt (D-CA) talking about the fact that Acting Attorney General Matt Whitaker was not approved by the Senate, but not mentioning the fact that Bob Mueller (who is highly conflicted) was not approved by the Senate!"
1064209246114459648,I will be interviewed by Chris Wallace on @FoxNews at 2:00 P.M. and 7:00 P.M. Enjoy!
1063835936604090368,"Heading to California with @GOPLeader Kevin McCarthy, @RepLaMalfa, and @KenCalvert. Look forward to being with our brave Firefighters, First Responders and @FEMA, along with the many brave People of California. We are with you all the way – God Bless you all!"
1063834733430206465,"....I can’t imagine any President having a better or closer relationship with their Vice President then the two of us. Just more FAKE NEWS, the Enemy of the People!"
1063834729584054272,"The New York Times did a phony story, as usual, about my relationship with @VP Mike Pence. They made up sources and refused to ask me, the only one that would know, for a quote...."
1063833980720504832,Congratulations to Andrew Gillum on having run a really tough and competitive race for Governor of the Great State of Florida. He will be a strong Democrat warrior long into the future - a force to reckon with!
1063758107229257728,"I can get Nancy Pelosi as many votes as she wants in order for her to be Speaker of the House. She deserves this victory, she has earned it - but there are those in her party who are trying to take it away. She will win! @TomReedCongress"
1063631319739953152,Thank you @JerryBrownGov. Look forward to joining you and @GavinNewsom tomorrow in California. We are with you! https://t.co/UuXWAadmov
1063593459695669254,"....their country’s flag. Can this be possible? Yes, because it is all a BIG CON, and the American taxpayer is paying for it!"
1063593456579354624,Isn’t it ironic that large Caravans of people are marching to our border wanting U.S.A. asylum because they are fearful of being in their country - yet they are proudly waving....
1063591994738515968,Congratulations to Brian Kemp on becoming the new Governor of Georgia. Stacey Abrams fought brilliantly and hard - she will have a terrific political future! Brian was unrelenting and will become a great Governor for the truly Wonderful People of Georgia!
1063591735169871872,"Congratulations to Ron DeSantis on becoming the new Governor of Florida. Against all odds, he fought &amp; fought &amp; fought, the result being a historic victory. He never gave up and never will. He will be a great Governor!"
1063517548258447361,"People are not being told that the Republican Party is on track to pick up two seats in the U.S. Senate, and epic victory: 53 to 47. The Fake News Media only wants to speak of the House, where the Midterm results were better than other sitting Presidents."
1063516048647995394,"Today in the East Room of the @WhiteHouse, it was my true privilege to award seven extraordinary Americans with the Presidential Medal of Freedom...https://t.co/TuEy635mav"
1063084073231544320,"The only “Collusion” is that of the Democrats with Russia and many others. Why didn’t the FBI take the Server from the DNC? They still don’t have it. Check out how biased Facebook, Google and Twitter are in favor of the Democrats. That’s the real Collusion!"
1063081553075625984,"Universities will someday study what highly conflicted (and NOT Senate approved) Bob Mueller and his gang of Democrat thugs have done to destroy people. Why is he protecting Crooked Hillary, Comey, McCabe, Lisa Page &amp; her lover, Peter S, and all of his friends on the other side?"
1063046973857718272,"....care how many lives the ruin. These are Angry People, including the highly conflicted Bob Mueller, who worked for Obama for 8 years. They won’t even look at all of the bad acts and crimes on the other side. A TOTAL WITCH HUNT LIKE NO OTHER IN AMERICAN HISTORY!"
1063042585802039296,"The inner workings of the Mueller investigation are a total mess. They have found no collusion and have gone absolutely nuts. They are screaming and shouting at people, horribly threatening them to come up with the answers they want. They are a disgrace to our Nation and don’t..."
1063038733673525248,"The White House is running very smoothly and the results for our Nation are obviously very good. We are the envy of the world. But anytime I even think about making changes, the FAKE NEWS MEDIA goes crazy, always seeking to make us look as bad as possible! Very dishonest!"
1062830145768165377,"I am grateful to be here today w/ Members of the House &amp; Senate who have poured their time, heart and energy into the crucial issue of Prison Reform. Working together w/ my Admin over the last two years, these members have reached a bipartisan agreement...https://t.co/wflidv2cZr"
1062796884648120320,"Just spoke to Governor Jerry Brown to let him know that we are with him, and the people of California, all the way!"
1062791114716000258,"Was just briefed by @FEMA_Brock and @SecretaryZinke, who are in California. Thank you to the great Firefighters, First Responders and @FEMA for the incredible job they are doing w/ the California Wildfires. Our Nation appreciates your heroism, courage &amp; genius. God Bless you all!"
1062789364399390720,"Not seen in many years, America’s steelworkers get a hard-earned raise because of my Administration’s policies to help bring back the U.S. steel industry, which is critical to our National Security. I will always protect America and its workers!"
1062459010660622339,"“Boom: Record high business optimism, need for employees at 45-year high” https://t.co/jBFjEwAcfd"
1062391577807601664,"The story in the New York Times concerning North Korea developing missile bases is inaccurate. We fully know about the sites being discussed, nothing new - and nothing happening out of the normal. Just more Fake News. I will be the first to let you know if things go bad!"
1062382618870726656,"When will Bill Nelson concede in Florida? The characters running Broward and Palm Beach voting will not be able to “find” enough votes, too much spotlight on them now!"
1062371844836261891,"By the way, when the helicopter couldn’t fly to the first cemetery in France because of almost zero visibility, I suggested driving. Secret Service said NO, too far from airport &amp; big Paris shutdown. Speech next day at American Cemetery in pouring rain! Little reported-Fake News!"
1062333882610171907,......MAKE FRANCE GREAT AGAIN!
1062333534214520832,"The problem is that Emmanuel suffers from a very low Approval Rating in France, 26%, and an unemployment rate of almost 10%. He was just trying to get onto another subject. By the way, there is no country more Nationalist than France, very proud people-and rightfully so!........"
1062331024426913792,"On Trade, France makes excellent wine, but so does the U.S. The problem is that France makes it very hard for the U.S. to sell its wines into France, and charges big Tariffs, whereas the U.S. makes it easy for French wines, and charges very small Tariffs. Not fair, must change!"
1062311785787744256,"Emmanuel Macron suggests building its own army to protect Europe against the U.S., China and Russia. But it was Germany in World Wars One &amp; Two - How did that work out for France? They were starting to learn German in Paris before the U.S. came along. Pay for NATO or not!"
1062153051459469312,I just approved an expedited request for a Major Disaster Declaration for the State of California. Wanted to respond quickly in order to alleviate some of the incredible suffering going on. I am with you all the way. God Bless all of the victims and families affected.
1062047641889095684,"Hopefully, Saudi Arabia and OPEC will not be cutting oil production. Oil prices should be much lower based on supply!"
1062045654711713792,"American Cable Association has big problems with Comcast. They say that Comcast routinely violates Antitrust Laws. “These guys are acting much worse, and have much more potential for damage to consumers, than anything AT&amp;T-Time Warner would do.” Charlie Gasparino"
1062020057616793600,"The California Fire Fighters, FEMA and  First Responders are amazing and very brave. Thank you and God Bless you all!"
1062005636488142848,The prospect of Presidential Harassment by the Dems is causing the Stock Market big headaches!
1061962869376540672,"The Florida Election should be called in favor of Rick Scott and Ron DeSantis in that large numbers of new ballots showed up out of nowhere, and many ballots are missing or forged. An honest vote count is no longer possible-ballots massively infected. Must go with Election Night!"
1061957074253418496,".....of money spent on protecting other countries, and we get nothing but Trade Deficits and Losses. It is time that these very rich countries either pay the United States for its great military protection, or protect themselves...and Trade must be made FREE and FAIR!"
1061954325843468288,".....hundreds of billions of dollars, for the great privilege of losing hundreds of billions of dollars with these same countries on trade. I told them that this situation cannot continue - It is, and always has been, ridiculously unfair to the United States. Massive amounts....."
1061952604807274498,"Just returned from France where much was accomplished in my meetings with World Leaders. Never easy bringing up the fact that the U.S. must be treated fairly, which it hasn’t, on both Military and Trade. We pay for LARGE portions of other countries military protection,........"
1061632874808520709,"Beautiful ceremony today in Paris commemorating the end of World War One. Many World leaders in attendance. Thank you to @EmmanuelMacron, President of France! Now off to Suresnes American Cemetery to make speech in honor of our great heroes! Then back to the U.S.A."
1061554334276747264,"With proper Forest Management, we can stop the devastation constantly going on in California. Get Smart!"
1061383163811893248,"These California fires are expanding very, very quickly (in some cases 80-100 acres a minute). If people don’t evacuate quickly, they risk being overtaken by the fire. Please listen to evacuation orders from State and local officials!"
1061382890100002817,"More than 4,000 are fighting the Camp and Woolsey Fires in California that have burned over 170,000 acres. Our hearts are with those fighting the fires, the 52,000 who have evacuated, and the families of the 11 who have died. The destruction is catastrophic. God Bless them all."
1061335051294728194,Trying to STEAL two big elections in Florida! We are watching closely!
1061334384337399808,Had very productive meetings and calls for our Country today. Meeting tonight with World Leaders!
1061171030801158146,"I am in Paris getting ready to celebrate the end of World War One. Is there anything better to celebrate than the end of a war, in particular that one, which was one of the bloodiest and worst of all time?"
1061168803218948096,"There is no reason for these massive, deadly and costly forest fires in California except that forest management is so poor. Billions of dollars are given each year, with so many lives lost, all because of gross mismanagement of the forests. Remedy now, or no more Fed payments!"
1061107399426220037,"....Mr. Whitaker is very highly thought of by @SenJoniErnst, Senator @ChuckGrassley, Ambassador @TerryBranstad, Leonard Leo of Federalist Society, and many more. I feel certain he will make an outstanding Acting Attorney General!"
1061104224090628097,"Matthew G. Whitaker is a highly respected former U.S. Attorney from Iowa. He was chosen by Jeff Sessions to be his Chief of Staff. I did not know Mr. Whitaker. Likewise, as Chief, I did not know Mr. Whitaker except primarily as he traveled with A.G. Sessions. No social contact..."
1061003186125856769,"President Macron of France has just suggested that Europe build its own military in order to protect itself from the U.S., China and Russia. Very insulting, but perhaps Europe should first pay its fair share of NATO, which the U.S. subsidizes greatly!"
1060993836984324096,"Just out — in Arizona, SIGNATURES DON’T MATCH. Electoral corruption - Call for a new Election? We must protect our Democracy!"
1060964991510110208,Thank you @marcorubio for helping to expose the potential corruption going on with respect to Election Theft in Broward and Palm Beach Counties. The WORLD is now watching closely!
1060960329876697088,"In the 2016 Election I was winning by so much in Florida that Broward County, which was very late with vote tabulation and probably getting ready to do a “number,” couldn’t do it because not enough people live in Broward for them to falsify a victory!"
1060958713047961600,Mayor Gillum conceded on Election Day and now Broward County has put him “back into play.” Bill Nelson conceded Election - now he’s back in play!? This is an embarrassment to our Country and to Democracy!
1060949297900834816,"Rick Scott was up by 50,000+ votes on Election Day, now they “found” many votes and he is only up 15,000 votes. “The Broward Effect.” How come they never find Republican votes?"
1060942600994050048,"Jeff Flake(y) doesn’t want to protect the Non-Senate confirmed Special Counsel, he wants to protect his future after being unelectable in Arizona for the “crime” of doing a terrible job! A weak and ineffective guy!"
