id,text
987282387196436480,Nancy Pelosi is going absolutely crazy about the big Tax Cuts given to the American People by the Republicans...got not one Democrat Vote! Here’s a choice. They want to end them and raise your taxes substantially. Republicans are working on making them permanent and more cuts!
987280537348866048,"So exciting! I have agreed to be the Commencement Speaker at our GREAT Naval Academy on May 25th in Annapolis, Maryland. Looking forward to being there."
987278269765517312,So General Michael Flynn’s life can be totally destroyed while Shadey James Comey can Leak and Lie and make lots of money from a third rate book (that should never have been written). Is that really the way life in America is supposed to work? I don’t think so!
987173366401585155,"James Comey Memos just out and show clearly that there was NO COLLUSION and NO OBSTRUCTION. Also, he leaked classified information. WOW! Will the Witch Hunt continue?"
987100052710674433,James Comey just threw Andrew McCabe “under the bus.” Inspector General’s Report on McCabe is a disaster for both of them! Getting a little (lot) of their own medicine?
987096152892944389,"Sanctuary Cities released at least 142 Gang Members across the United States, making it easy for them to commit all forms of violent crimes where none would have existed. We are doing a great job of law enforcement, but things such as this make safety in America difficult!"
987096105841315841,"My thoughts, prayers and condolences are with the families, friends and colleagues of the two @GCSOFlorida deputies (HEROES) who lost their lives in the line of duty today."
987066289855303681,Mike Pompeo is outstanding. First in his class at West Point. A top student at Harvard Law School. A success at whatever he has done. We need the Senate to approve Mike ASAP. He will be a great Secretary of State!
987065049566138375,"...Hopefully the Senate will not leave Washington until our Ambassadors, Judges and the people who make Washington work are approved. The Democrats are Obstructing the process and we need these people approved for the good of our Country!"
987063604691259393,"Democrats are obstructing good (hopefully great) people wanting to give up a big portion of their life to work for our Government, hence, the American People. They are “slow walking” all of my nominations - hundreds of people. At this rate it would take 9 years for all approvals!"
987038167730552832,".@MarshaBlackburn is a wonderful woman who has always been there when we have needed her. Great on the Military, Border Security and Crime. Loves and works hard for the people of Tennessee. She has my full endorsement and I will be there to campaign with her!"
987036458648199168,"THANK YOU #JIATFSouth, @Norad_Northcom, @southcomwatch and @DHSgov. Keep up the GREAT work! https://t.co/3v2uG6Jp1T"
986994992177561600,"Governor Jerry Brown announced he will deploy “up to 400 National Guard Troops” to do nothing. The crime rate in California is high enough, and the Federal Government will not be paying for Governor Brown’s charade. We need border security and action, not words!"
986988633822412800,"Thank you San Diego County for defending the rule of law and supporting our lawsuit against California's illegal and unconstitutional 'Sanctuary' policies. California's dangerous policies release violent criminals back into our communities, putting all Americans at risk."
986979039670931458,"Great meeting with Prime Minister Abe of Japan, who has just left Florida. Talked in depth about North Korea, Military and Trade. Good things will happen!"
986643179452747776,Best wishes to Prime Minister @Netanyahu and all of the people of Israel on the 70th Anniversary of your Great Independence. We have no better friends anywhere. Looking forward to moving our Embassy to Jerusalem next month!
986576502358671361,"Slippery James Comey, the worst FBI Director in history, was not fired because of the phony Russia investigation where, by the way, there was NO COLLUSION (except by the Dems)!"
986555533535731712,"Mike Pompeo met with Kim Jong Un in North Korea last week. Meeting went very smoothly and a good relationship was formed. Details of Summit are being worked out now. Denuclearization will be a great thing for World, but also for North Korea!"
986547093610299392,"A sketch years later about a nonexistent man. A total con job, playing the Fake News Media for Fools (but they know it)! https://t.co/9Is7mHBFda"
986544648477868032,"There is a Revolution going on in California. Soooo many Sanctuary areas want OUT of this ridiculous, crime infested &amp; breeding concept. Jerry Brown is trying to back out of the National Guard at the Border, but the people of the State are not happy. Want Security &amp; Safety NOW!"
986436520444866560,"While Japan and South Korea would like us to go back into TPP, I don’t like the deal for the United States. Too many contingencies and no way to get out if it doesn’t work. Bilateral deals are far more efficient, profitable and better for OUR workers. Look how bad WTO is to U.S."
986432143189512192,"Pastor Andrew Brunson, a fine gentleman and Christian leader in the United States, is on trial and being persecuted in Turkey for no reason. They call him a Spy, but I am more a Spy than he is. Hopefully he will be allowed to come home to his beautiful family where he belongs!"
986378606606737408,States and Cities throughout our Country are being cheated and treated so badly by online retailers. Very unfair to traditional tax paying stores!
986357230219022342,....Congress – House and Senate must quickly pass a legislative fix to ensure violent criminal aliens can be removed from our society. Keep America Safe!
986357228306354178,"Today’s Court decision means that Congress must close loopholes that block the removal of dangerous criminal aliens, including aggravated felons. This is a public safety crisis that can only be fixed by...."
986303188587425794,"Rasmussen just came out at 51% Approval despite the Fake News Media. They were one of the three most accurate on Election Day. Just about the most inaccurate were CNN and ABC News/Washington Post, and they haven’t changed (get new pollsters). Much of the media is a Scam!"
986301228337508354,"Getting ready to meet Prime Minister Abe of Japan, a truly fine gentleman!"
986218871991492608,"So many people are seeing the benefits of the Tax Cut Bill. Everyone is talking, really nice to see!"
986218870506754048,Looks like Jerry Brown and California are not looking for safety and security along their very porous Border. He cannot come to terms for the National Guard to patrol and protect the Border. The high crime rate will only get higher. Much wanted Wall in San Diego already started!
986218867780448261,I am in Florida and looking forward to my meeting with Prime Minister Abe of Japan. Working on Trade and Military Security.
986218862625648640,"Employment is up, Taxes are DOWN. Enjoy!"
985858100149309441,Russia and China are playing the Currency Devaluation game as the U.S. keeps raising interest rates. Not acceptable!
985856662866202624,"Comey drafted the Crooked Hillary exoneration long before he talked to her (lied in Congress to Senator G), then based his decisions on her poll numbers. Disgruntled, he, McCabe, and the others, committed many crimes!"
985529299905187840,"Just hit 50% in the Rasmussen Poll, much higher than President Obama at same point. With all of the phony stories and Fake News, it’s hard to believe! Thank you America, we are doing Great Things."
985504808646971392,"Slippery James Comey, a man who always ends up badly and out of whack (he is not smart!), will go down as the WORST FBI Director in history, by far!"
985502053345751040,"Attorney Client privilege is now a thing of the past. I have many (too many!) lawyers and they are probably wondering when their offices, and even homes, are going to be raided with everything, including their phones and computers, taken. All lawyers are deflated and concerned!"
985496023555608576,I never asked Comey for Personal Loyalty. I hardly even knew this guy. Just another of his many lies. His “memos” are self serving and FAKE!
985492862958698497,"The Syrian raid was so perfectly carried out, with such precision, that the only way the Fake News Media could demean was by my use of the term “Mission Accomplished.” I knew they would seize on this but felt it is such a great Military term, it should be brought back. Use often!"
985489930343321600,"Comey throws AG Lynch “under the bus!” Why can’t we all find out what happened on the tarmac in the back of the plane with Wild Bill and Lynch? Was she promised a Supreme Court seat, or AG, in order to lay off Hillary. No golf and grandkids talk (give us all a break)!"
985487209510948864,"The big questions in Comey’s badly reviewed book aren’t answered like, how come he gave up Classified Information (jail), why did he lie to Congress (jail), why did the DNC refuse to give Server to the FBI (why didn’t they TAKE it), why the phony memos, McCabe’s $700,000 &amp; more?"
985483513704124416,"Unbelievably, James Comey states that Polls, where Crooked Hillary was leading, were a factor in the handling (stupidly) of the Clinton Email probe. In other words, he was making decisions based on the fact that he thought she was going to win, and he wanted a job. Slimeball!"
985133017256660995,"So proud of our great Military which will soon be, after the spending of billions of fully approved dollars, the finest that our Country has ever had. There won’t be anything, or anyone, even close!"
985130802668294144,A perfectly executed strike last night. Thank you to France and the United Kingdom for their wisdom and the power of their fine Military. Could not have had a better result. Mission Accomplished!
984967457315139586,https://t.co/6VLQYAlcto
984877999718895616,"DOJ just issued the McCabe report - which is a total disaster. He LIED! LIED! LIED! McCabe was totally controlled by Comey - McCabe is Comey!! No collusion, all made up by this den of thieves and lowlifes!"
984767560494313472,"....untruthful slime ball who was, as time has proven, a terrible Director of the FBI. His handling of the Crooked Hillary Clinton case, and the events surrounding it, will go down as one of the worst “botch jobs” of history. It was my great honor to fire James Comey!"
984763579210633216,"James Comey is a proven LEAKER &amp; LIAR. Virtually everyone in Washington thought he should be fired for the terrible job he did-until he was, in fact, fired. He leaked CLASSIFIED information, for which he should be prosecuted. He lied to Congress under OATH. He is a weak and....."
984759315046322177,"Tremendous pressure is building, like never before, for the Border Wall and an end to crime cradling Sanctuary Cities. Started the Wall in San Diego, where the people were pushing really hard to get it. They will soon be protected!"
984631073865953280,"Would only join TPP if the deal were substantially better than the deal offered to Pres. Obama. We already have BILATERAL deals with six of the eleven nations in TPP, and are working to make a deal with the biggest of those  nations, Japan, who has hit us hard on trade for years!"
984472778035417088,"I have agreed with the historically cooperative, disciplined approach that we have engaged in with Robert Mueller (Unlike the Clintons!). I have full confidence in Ty Cobb, my Special Counsel, and have been fully advised throughout each phase of this process."
984471933050937344,"On Yom HaShoah we remember the six million Jews slaughtered in the Holocaust. With each passing year, our duty to remember this atrocity increases as we pledge #NeverAgain. #HolocaustRemembranceDay https://t.co/tyga4VtjLT"
984379918682394624,Good luck to Mike Pompeo during his Confirmation Hearing today. He will be a great Secretary of State!
984374422587965440,"Never said when an attack on Syria would take place. Could be very soon or not so soon at all! In any event, the United States, under my Administration, has done a great job of ridding the region of ISIS. Where is our “Thank you America?”"
984372760230154241,"California Governor Jerry Brown is doing the right thing and sending the National Guard to the Border. Thank you Jerry, good move for the safety of our Country!"
984371491277099010,"If I wanted to fire Robert Mueller in December, as reported by the Failing New York Times, I would have fired him. Just more Fake News from a biased newspaper!"
984231791103012864,Big show tonight on @seanhannity! 9:00 P.M. on @FoxNews
984155907251687424,“Trump just took a giant step towards actual welfare reform” https://t.co/LQlACDDLug
984066131303583746,"Speaker Paul Ryan is a truly good man, and while he will not be seeking re-election, he will leave a legacy of achievement that nobody can question. We are with you Paul!"
984053549742067712,"Much of the bad blood with Russia is caused by the Fake &amp; Corrupt Russia Investigation, headed up by the all Democrat loyalists, or people that worked for Obama. Mueller is most conflicted of all (except Rosenstein who signed FISA &amp; Comey letter). No Collusion, so they go crazy!"
984032798821568513,"Our relationship with Russia is worse now than it has ever been, and that includes the Cold War. There is no reason for this. Russia needs us to help with their economy, something that would be very easy to do, and we need all nations to work together. Stop the arms race?"
984022625440747520,"Russia vows to shoot down any and all missiles fired at Syria. Get ready Russia,  because they will be coming, nice and new and “smart!” You shouldn’t be partners with a Gas Killing Animal who kills his people and enjoys it!"
984020136255541248,"....doing things that nobody thought possible, despite the never ending and corrupt Russia Investigation, which takes tremendous time and focus. No Collusion or Obstruction (other than I fight back), so now they do the Unthinkable, and RAID a lawyers office for information! BAD!"
984017894240604161,"So much Fake News about what is going on in the White House. Very calm and calculated with a big focus on open and fair trade with China, the coming North Korea meeting and, of course, the vicious gas attack in Syria. Feels great to have Bolton &amp; Larry K on board. I (we) are"
984015782521835521,"The Failing New York Times wrote another phony story. It was political pundit Doug Schoen, not a Ukrainian businessman, who asked me to do a short speech by phone (Skype), hosted by Doug, in Ukraine. I was very positive about Ukraine-another negative to the Fake Russia  C story!"
983774270886236161,"Very thankful for President Xi of China’s kind words on tariffs and automobile barriers...also, his enlightenment on intellectual property and technology transfers. We will make great progress together!"
983662953894436864,A TOTAL WITCH HUNT!!!
983662868540346371,Attorney–client privilege is dead!
983284198046826496,"When a car is sent to the United States from China, there is a Tariff to be paid of 2 1/2%. When a car is sent to China from the United States, there is a Tariff to be paid of 25%. Does that sound like free or fair trade.  No, it sounds like STUPID TRADE -  going on for years!"
983143317889323008,"Congratulations to Patrick Reed on his great and courageous MASTERS win! When Patrick had his amazing win at Doral 5 years ago, people saw his great talent, and a bright future ahead. Now he is the Masters Champion!"
982969547283161090,"If President Obama had crossed his stated Red Line In The Sand, the Syrian disaster would have ended long ago! Animal Assad would have been history!"
982967389028569088,....to pay. Open area immediately for medical help and verification. Another humanitarian disaster for no reason whatsoever. SICK!
982966315467116544,"Many dead, including women and children, in mindless CHEMICAL attack in Syria. Area of atrocity is in lockdown and encircled by Syrian Army, making it completely inaccessible to outside world. President Putin, Russia and Iran are responsible for backing Animal Assad. Big price..."
982954355509907457,"President Xi and I will always be friends, no matter what happens with our dispute on trade. China will take down its Trade Barriers because it is the right thing to do. Taxes will become Reciprocal &amp; a deal will be made on Intellectual Property. Great future for both countries!"
982950739441004544,"The Washington Post is far more fiction than fact. Story after story is made up garbage - more like a poorly written novel than good reporting. Always quoting sources (not names), many of which don’t exist. Story on John Kelly isn’t true, just another hit job!"
982943088330108928,"“The FBI closed the case on Hillary, which was a rigged investigation. They exonerated her even before they ever interviewed her, they never even put her under oath.....” and much more. So true Jesse! @WattersWorld"
982770847046922240,"While Security spending was somewhat more than his predecessor, Scott Pruitt has received death threats because of his bold actions at EPA. Record clean Air &amp; Water while saving USA Billions of Dollars. Rent was about market rate, travel expenses OK. Scott is doing a great job!"
982750459877380096,Fire at Trump Tower is out. Very confined (well built building). Firemen (and women) did a great job. THANK YOU!
982724858743328777,"What does the Department of Justice and FBI have to hide? Why aren’t they giving the strongly requested documents (unredacted) to the HOUSE JUDICIARY COMMITTEE? Stalling, but for what reason? Not looking good!"
982722926305832960,"Lawmakers of the House Judiciary Committee are angrily accusing the Department of Justice of missing the Thursday Deadline for turning over UNREDACTED Documents relating to FISA abuse, FBI, Comey, Lynch, McCabe, Clinton Emails and much more. Slow walking - what is going on? BAD!"
982682227581636608,We are sealing up our Southern Border. The people of our great country want Safety and Security. The Dems have been a disaster on this very important issue!
982680387116781568,"The United States hasn’t had a Trade Surplus with China in 40 years. They must end unfair trade, take down barriers and charge only Reciprocal Tariffs. The U.S. is losing $500 Billion a year, and has been losing Billions of Dollars for decades. Cannot continue!"
982673223719489536,Just spoke to @JustinTrudeau to pay my highest respect and condolences to the families of the terrible Humboldt Team tragedy. May God be with them all!
982353975595929600,Congratulations to @bernieandsid on their new @77wabcradio morning radio show in New York City. It was an honor to join you two – good luck! https://t.co/sulTcRp3IC
982353242196766720,“BET founder: Trump's economy is bringing black workers back into the labor force” https://t.co/TtMDfi4bv0
982268230306709509,"Do you believe that the Fake News Media is pushing hard on a story that I am going to replace A.G. Jeff Sessions with EPA Chief Scott Pruitt, who is doing a great job but is TOTALLY under siege? Do people really believe this stuff? So much of the media is dishonest and corrupt!"
982264844136017921,"China, which is a great economic power, is considered a Developing Nation within the World Trade Organization. They therefore get tremendous perks and advantages, especially over the U.S. Does anybody think this is fair. We were badly represented. The WTO is unfair to U.S."
982214297160839173,"Despite the Aluminum Tariffs, Aluminum prices are DOWN 4%. People are surprised, I’m not! Lots of money coming into U.S. coffers and Jobs, Jobs, Jobs!"
981881669593559040,"The Fake News Washington Post, Amazon’s “chief lobbyist,” has another (of many) phony headlines, “Trump Defiant As China Adds Trade Penalties.” WRONG! Should read, “Trump Defiant as U.S. Adds Trade Penalties, Will End Barriers And Massive  I.P. Theft.” Typically bad reporting!"
981859214380462081,"The Caravan is largely broken up thanks to the strong immigration laws of Mexico and their willingness to use them so as not to cause a giant scene at our Border. Because of the Trump Administrations actions, Border crossings are at a still UNACCEPTABLE 46 year low. Stop drugs!"
981669823221559302,“Still Rising: Rasmussen Poll Shows Donald Trump Approval Ratings Now at 51 Percent” https://t.co/q80PaE0gQo
981544432762802176,"Our thoughts and prayers are with the four U.S. Marines from the 3rd Marine Aircraft Wing who lost their lives in yesterday’s Southern California helicopter crash. We pray for their families, and our great @USMC."
981521901079146499,"When you’re already $500 Billion DOWN, you can’t lose!"
981492087328792577,"We are not in a trade war with China, that war was lost many years ago by the foolish, or incompetent, people who represented the U.S. Now we have a Trade Deficit of $500 Billion a year, with Intellectual Property Theft of another $300 Billion. We cannot let this continue!"
981491439233355776,"Our Border Laws are very weak while those of Mexico &amp; Canada are very strong. Congress must change these Obama era, and other, laws NOW! The Democrats stand in our way - they want people to pour into our country unchecked....CRIME! We will be taking strong action today."
981287536520847360,"Was just briefed on the shooting at YouTube’s HQ in San Bruno, California. Our thoughts and prayers are with everybody involved. Thank you to our phenomenal Law Enforcement Officers and First Responders that are currently on the scene."
981168344924536832,I am right about Amazon costing the United States Post Office massive amounts of money for being their Delivery Boy. Amazon should pay these costs (plus) and not have them bourne by the American Taxpayer. Many billions of dollars. P.O. leaders don’t have a clue (or do they?)!
981126375716409344,"Thank you to Rasmussen for the honest polling. Just hit 50%, which is higher than Cheatin’ Obama at the same time in his Administration."
981123772169191424,"Check out the fact that you can’t get a job at ratings challenged @CNN unless you state that you are totally anti-Trump? Little Jeff Zuker, whose job is in jeopardy, is not having much fun lately. They should clean up and strengthen CNN and get back to honest reporting!"
981121409807155200,"The big Caravan of People from Honduras, now coming across Mexico and heading to our “Weak Laws” Border, had better be stopped before it gets there. Cash cow NAFTA is in play, as is foreign aid to Honduras and the countries that allow this to happen. Congress MUST ACT NOW!"
981117684489379840,"The Fake News Networks, those that knowingly have a sick and biased AGENDA, are worried about the competition and quality of Sinclair Broadcast. The “Fakers” at CNN, NBC, ABC &amp; CBS have done so much dishonest reporting that they should only be allowed to get awards for fiction!"
980964100502118400,"39% of my nominations, including Diplomats to foreign lands, have not been confirmed due to Democrat obstruction and delay. At this rate, it would take more than 7 years before I am allowed to have these great people start working. Never happened before. Disgraceful!"
980961086546632705,"Honduras, Mexico and many other countries that the U.S. is very generous to, sends many of their people to our country through our WEAK IMMIGRATION POLICIES. Caravans are heading here. Must pass tough laws and build the WALL. Democrats allow open borders, drugs and crime!"
980958298445885446,"As ridiculous as it sounds, the laws of our country do not easily allow us to send those crossing our Southern Border back where they came from. A whole big wasted procedure must take place. Mexico &amp; Canada have tough immigration laws, whereas ours are an Obama joke. ACT CONGRESS"
980846943130746881,"“President Donald J. Trump Proclaims April 2, 2018, World Autism Awareness Day” https://t.co/ECBCHfll0p"
980806557846863872,"So sad that the Department of “Justice” and the FBI are slow walking, or even not giving, the unredacted documents requested by Congress. An embarrassment to our country!"
980800783313702918,"Only fools, or worse, are saying that our money losing Post Office makes money with Amazon. THEY LOSE A FORTUNE, and this will be changed. Also, our fully tax paying retailers are closing stores all over the country...not a level playing field!"
980799183425802240,"So funny to watch Fake News Networks, among the most dishonest groups of people I have ever dealt with, criticize Sinclair Broadcasting for being biased. Sinclair is far superior to CNN and even more Fake NBC, which is a total joke."
980794173279342592,"Mexico is making a fortune on NAFTA...They have very strong border laws - ours are pathetic. With all of the money they make from the U.S., hopefully they will stop people from coming through their country and into ours, at least until Congress changes our immigration laws!"
980766121983987712,"DACA is dead because the Democrats didn’t care or act, and now everyone wants to get onto the DACA bandwagon... No longer works. Must build Wall and secure our borders with proper Border legislation. Democrats want No Borders, hence drugs and crime!"
980764358530789380,"...Congress must immediately pass Border Legislation, use Nuclear Option if necessary, to stop the massive inflow of Drugs and People. Border Patrol Agents (and ICE) are GREAT, but the weak Dem laws don’t allow them to do their job. Act now Congress, our country is being stolen!"
980762392303980544,"Mexico has the absolute power not to let these large “Caravans” of people enter their country. They must stop them at their Northern Border, which they can do because their border laws work, not allow them to pass through into our country, which has no effective border laws....."
980451798606602241,These big flows of people are all trying to take advantage of DACA. They want in on the act!
