id,text
1014956573095915520,...on Monday assume duties as the acting Administrator of the EPA. I have no doubt that Andy will continue on with our great and lasting EPA agenda. We have made tremendous progress and the future of the EPA is very bright!
1014956568129892352,"I have accepted the resignation of Scott Pruitt as the Administrator of the Environmental Protection Agency. Within the Agency Scott has done an outstanding job, and I will always be thankful to him for this. The Senate confirmed Deputy at EPA, Andrew Wheeler, will..."
1014875894614319104,Congress - FIX OUR INSANE IMMIGRATION LAWS NOW!
1014875575557804034,".....Country being forced to endure a long and costly trial. Tell the people “OUT,” and they must leave, just as they would if they were standing on your front lawn. Hiring thousands of “judges” does not work and is not acceptable - only Country in the World that does this!"
1014873774003556354,"Congress must pass smart, fast and reasonable Immigration Laws now. Law Enforcement at the Border is doing a great job, but the laws they are forced to work with are insane. When people, with or without children, enter our Country, they must be told to leave without our........"
1014611307427966976,"The OPEC Monopoly must remember that gas prices are up &amp; they are doing little to help. If anything, they are driving prices higher as the United States defends many of their members for very little $’s. This must be a two way street. REDUCE PRICING NOW!"
1014519862482407424,Happy Fourth of July....Our Country is doing GREAT!
1014295759393644545,"...has endured because of the sweat, blood and sacrifice of the American Armed Forces – the greatest force for peace and justice in the history of the world!"
1014295751814533120,"Tonight we gathered to celebrate the courageous men and women who make freedom possible: our brave service members, and our wonderful Veterans. For 242 years, American Independence..."
1014287566386888709,"Thank you, @WVGovernor Jim Justice, for that warm introduction. Tonight, it was my great honor to attend the “Greenbrier Classic – Salute to Service Dinner” in West Virginia! God Bless our Veterans. God Bless America - and HAPPY INDEPENDENCE DAY TO ALL! https://t.co/V35qvCN8m6"
1014286054805987330,"After having written many best selling books, and somewhat priding myself on my ability to write, it should be noted that the Fake News constantly likes to pore over my tweets looking for a mistake. I capitalize certain words only for emphasis, not b/c they should be capitalized!"
1014261296240488450,"The Washington Post is constantly quoting “anonymous sources” that do not exist. Rarely do they use the name of anyone because there is no one to give them the kind of negative quote that they are looking for. They are a disgrace to journalism but then again, so are many others!"
1014258987422928896,"Heading to West Virginia to be with my friend, @WVGovernor Jim Justice, at his beautiful Greenbrier Resort. He works hard, does a great job, and raises lots of money for charities!"
1014151457954811904,Wow! The NSA has deleted 685 million phone calls and text messages. Privacy violations? They blame technical irregularities. Such a disgrace. The Witch Hunt continues!
1014146835135516672,"Now that Harley-Davidson is moving part of its operation out of the U.S., my Administration is working with other Motor Cycle companies who want to move into the U.S. Harley customers are not happy with their move - sales are down 7% in 2017. The U.S. is where the Action is!"
1014117468858650624,"Just out that the Obama Administration granted citizenship, during the terrible Iran Deal negotiation, to 2,500 Iranians - including to government officials. How big (and bad) is that?"
1014105549624037377,"Many good conversations with North Korea-it is going well! In the meantime, no Rocket Launches or Nuclear Testing in 8 months. All of Asia is thrilled. Only the Opposition Party, which includes the Fake News, is complaining. If not for me, we would now be at War with North Korea!"
1014100908127543296,"How can the Democrats, who are weak on the Border and weak on Crime, do well in November. The people of our Country want and demand Safety and Security, while the Democrats are more interested in  ripping apart and demeaning (and not properly funding) our great Law Enforcement!"
1014098721460686849,"When we have an “infestation” of MS-13 GANGS in certain parts of our country, who do we send to get them out? ICE! They are tougher and smarter than these rough criminal elelments that bad immigration laws allow into our country. Dems do not appreciate the great job they do! Nov."
1014094834863362049,"The economy is doing perhaps better than ever before, and that’s prior to fixing some of the worst and most unfair Trade Deals ever made by any country. In any event, they are coming along very well. Most countries agree that they must be changed, but nobody ever asked!"
1014092792329535488,I interviewed 4 very impressive people yesterday. On Monday I will be announcing my decision for Justice of the United States Supreme Court!
1014090584963866624,"Crazy Maxine Waters, said by some to be one of the most corrupt people in politics, is rapidly becoming, together with Nancy Pelosi, the FACE of the Democrat Party. Her ranting and raving, even referring to herself as a wounded animal, will make people flee the Democrats!"
1013976609290964997,"Many Democrats are deeply concerned about the fact that their “leadership” wants to denounce and abandon the great men and women of ICE, thereby declaring war on Law &amp; Order. These people will be voting for Republicans in November and, in many cases, joining the Republican Party!"
1013618640061595648,Congratulations to Andres Manuel Lopez Obrador on becoming the next President of Mexico. I look very much forward to working with him. There is much to be done that will benefit both the United States and Mexico!
1013507396558303233,"A big week, especially with our numerous victories in the Supreme Court. Heading back to the White House now. Focus will be on the selection of a new Supreme Court Justice. Exciting times for our country. Economy may be stronger than it has ever been!"
1013394559429169152,"The Liberal Left, also known as the Democrats, want to get rid of ICE, who do a fantastic job, and want Open Borders. Crime would be rampant and uncontrollable! Make America Great Again"
1013391783533989888,I will be interviewed by @MariaBartiromo at 10:00 A.M. on @FoxNews
1013146187510243328,"When people come into our Country illegally, we must IMMEDIATELY escort them back out without going through years of legal maneuvering. Our laws are the dumbest anywhere in the world. Republicans want Strong Borders and no Crime. Dems want Open Borders and are weak on Crime!"
1013143055417905152,I will be interviewed by @MariaBartiromo on Sunday on @FoxNews at 10:00 A. M. Enjoy!
1013141673776500736,"Either we need to elect more Republicans in November or Republicans must end the ridiculous 60 vote, or Filibuster, rule - or better yet, do both. Cryin’ Chuck would do it on day one, but we’ll never give him the chance. Some great legislation awaits - be smart!"
1013139532290625538,"I never pushed the Republicans in the House to vote for the Immigration Bill, either GOODLATTE 1 or 2, because it could never have gotten enough Democrats as long as there is the 60 vote threshold. I released many prior to the vote knowing we need more Republicans to win in Nov."
1013136536576188416,"A friend of mine and a man who has truly seen politics and life as few others ever will, Sean Spicer, has written a great new book, “The Briefing: Politics, the Press and the President.” It is a story told with both heart and knowledge. Really good, go get it!"
1013037916216614912,"I will be making my choice for Justice of the United States Supreme Court on the first Monday after the July 4th Holiday, July 9th!"
1013023608040513537,"Just spoke to King Salman of Saudi Arabia and explained to him that, because of the turmoil &amp; disfunction in Iran and Venezuela, I am asking that Saudi Arabia increase oil production, maybe up to 2,000,000 barrels, to make up the difference...Prices to high! He has agreed!"
1013019990340046849,"To the great and brave men and women of ICE, do not worry or lose your spirit. You are doing a fantastic job of keeping us safe by eradicating the worst criminal elements. So brave! The radical left Dems want you out. Next it will be all police. Zero chance, It will never happen!"
1013016168377081856,"The Democrats are making a strong push to abolish ICE, one of the smartest, toughest and most spirited law enforcement groups of men and women that I have ever seen. I have watched ICE liberate towns from the grasp of MS-13 &amp; clean out the toughest of situations. They are great!"
1012840647743737857,The new plant being built by Foxconn in Wisconsin is incredible. Congratulations to the people of Wisconsin and to Governor Scott Walker @GovWalker and his talented representatives for having pulled it off. Great job!
1012759156426670083,"Six months after our TAX CUTS, more than 6 MILLION workers have received bonuses, pay raises, and retirement account contributions.
#TaxCutsandJobsAct https://t.co/MevjwIINGU"
1012437964373123072,"Prior to departing Wisconsin, I was briefed on the shooting at Capital Gazette in Annapolis, Maryland. My thoughts and prayers are with the victims and their families. Thank you to all of the First Responders who are currently on the scene."
1012412743520047111,"AMERICA IS OPEN FOR BUSINESS! 
https://t.co/fuRF2Z6CZl"
1012321218056384513,"I am in Milwaukee, Wisconsin, for meetings. Soon to leave for a big groundbreaking for Foxconn, which is building a great new electronics plant in Wisconsin. 15,000 Jobs, so great!"
1012318771250384896,"....persecuted on old and/or totally unrelated charges (there was no collusion and there was no obstruction of the no collusion)...And what is going on in the FBI &amp; DOJ with Crooked Hillary, the DNC and all of the lies? A disgraceful situation!"
1012315534220808192,"When is Bob Mueller going to list his Conflicts of Interest? Why has it taken so long? Will they be listed at the top of his $22,000,000 Report...And what about the 13 Angry Democrats, will they list their conflicts with Crooked H? How many people will be sent to jail and......"
1012312287280074754,"Peter Strzok worked as the leader of the Rigged Witch Hunt for a long period of time - he got it started and was only fired because the gig was up. But remember, he took his orders from Comey and McCabe and they took their orders from you know who. Mueller/Comey best friends!"
1012299239207198721,"Just watched @SharkGregNorman on @foxandfriends. Said “President is doing a great job. All over the world, people want to come back to the U.S.” Thank you Greg, and you’re looking and doing great!"
1012297599431401474,"Amy Kremer, Women for Trump, was so great on @foxandfriends. Brave and very smart, thank you Amy! @AmyKremer"
1012295859072126977,"Russia continues to say they had nothing to do with Meddling in our Election! Where is the DNC Server, and why didn’t Shady James Comey and the now disgraced FBI agents take and closely examine it? Why isn’t Hillary/Russia being looked at? So many questions, so much corruption!"
1012290012279435265,"Lover FBI Agent Peter Strzok was given poor marks on yesterday’s closed door testimony and, according to most reports, refused to answer many questions. There was no Collusion and the Witch Hunt, headed by 13 Angry Democrats and others who are totally conflicted, is Rigged!"
1012174976668061699,...home addresses – putting these selfless public servants in harm’s way. These radical protesters want ANARCHY – but the only response they will find from our government is LAW AND ORDER!
1012174975061647360,In recent days we have heard shameless attacks on our courageous law enforcement officers. Extremist Democrat politicians have called for the complete elimination of ICE. Leftwing Activists are trying to block ICE officers from doing their jobs and publicly posting their...
1012070304091435010,"Heading to North Dakota to fully stand with and endorse Kevin Cramer for Senate. He is an extraordinary Congressman who will hopefully soon represent this great state as your Senator. He is tough on crime, strong on borders, loves our Military, and our Vets! #NDSen https://t.co/uP95m0sIRP"
1011994162076573697,"Harley-Davidson should stay 100% in America, with the people that got you your success. I’ve done so much for you, and then this. Other companies are coming back where they belong! We won’t forget, and neither will your customers or your now very HAPPY competitors!"
1011975204778729474,"Supreme Court rules in favor of non-union workers who are now, as an example, able to support a candidate of his or her choice without having those who control the Union deciding for them. Big loss for the coffers of the Democrats!"
1011952266268545024,"HOUSE REPUBLICANS SHOULD PASS THE STRONG BUT FAIR IMMIGRATION BILL, KNOWN AS GOODLATTE II, IN THEIR AFTERNOON VOTE TODAY, EVEN THOUGH THE DEMS WON’T LET IT PASS IN THE SENATE. PASSAGE WILL SHOW THAT WE WANT STRONG BORDERS &amp; SECURITY WHILE THE DEMS WANT OPEN BORDERS = CRIME.  WIN!"
1011931656230526976,"Congratulations to Maxine Waters, whose crazy rants have made her, together with Nancy Pelosi, the unhinged FACE of the Democrat Party. Together, they will Make America Weak Again! But have no fear, America is now stronger than ever before, and I’m not going anywhere!"
1011819474574561283,Big and conclusive win by Mitt Romney. Congratulations! I look forward to working together - there is so much good to do. A great and loving family will be coming to D.C.
1011806195462688768,The legendary Gary Player at Turnberry in Scotland! https://t.co/3oGoqWhhtA
1011805006390071304,A great First Lady! https://t.co/Pt35aluI4C
1011803149911384064,"The Democrats are in Turmoil! Open Borders and unchecked Crime a certain way to lose elections. Republicans are for Strong Borders, NO Crime! A BIG NIGHT!"
1011795883925663744,"Wow! Big Trump Hater Congressman Joe Crowley, who many expected was going to take Nancy Pelosi’s place, just LOST his primary election. In other words, he’s out! That is a big one that nobody saw happening. Perhaps he should have been nicer, and more respectful, to his President!"
1011792563425116161,"Tremendous win for Congressman Dan Donovan. You showed great courage in a tough race! New York, and my many friends on Staten Island, have elected someone they have always been very proud of. Congratulations!"
1011789419521675264,Congratulations to Governor Henry McMaster on your BIG election win! South Carolina loves you. We are all proud of you and Peggy! @henrymcmaster
1011703668721246209,"Today, we tell the story of an incredible HERO who defended our nation in World War Two – First Lieutenant Garlin Murl Conner. Although he died 20 years ago, today he takes his rightful place in the Eternal Chronicle of American Valor...https://t.co/mzJ8pPPgZE"
1011620271327989760,SUPREME COURT UPHOLDS TRUMP TRAVEL BAN. Wow!
1011602664143106048,"“The most profound question of our era: Was there a conspiracy in the Obama Department of Justice and the FBI to prevent Donald Trump from becoming President of the U.S., and was Strzok at the core of the conspiracy?”  Judge Andrew Napolitano"
1011588967442022406,"The face of the Democrats is now Maxine Waters who, together with Nancy Pelosi, have established a fine leadership team. They should always stay together and lead the Democrats, who want Open Borders and Unlimited Crime, well into the future....and pick Crooked Hillary for Pres."
1011584315040419840,"A Harley-Davidson should never be built in another country-never! Their employees and customers are already very angry at them. If they move, watch, it will be the beginning of the end - they surrendered, they quit! The Aura will be gone and they will be taxed like never before!"
1011579076493144065,"It was great being with Governor Henry McMaster last night in South Carolina. Henry is tough on Crime and Borders, loves our Military and our Vets and has created many jobs and a great economy. GO OUT AND VOTE FOR HENRY TODAY, HE WILL NEVER LET YOU DOWN!"
1011577303023980544,....We are finishing our study of Tariffs on cars from the E.U. in that they have long taken advantage of the U.S. in the form of Trade Barriers and Tariffs. In the end it will all even out - and it won’t take very long!
1011574256117993472,"....When I had Harley-Davidson officials over to the White House, I chided them about tariffs in other countries, like India, being too high. Companies are now coming back to America. Harley must know that they won’t be able to sell back into U.S. without paying a big tax!"
1011571026034089984,"....We are getting other countries to reduce and eliminate tariffs and trade barriers that have been unfairly used for years against our farmers, workers and companies. We are opening up closed markets and expanding our footprint. They must play fair or they will pay tariffs!"
1011568906992017408,"Early this year Harley-Davidson said they would move much of their plant operations in Kansas City to Thailand. That was long before Tariffs were announced. Hence, they were just using Tariffs/Trade War as an excuse. Shows how unbalanced &amp; unfair trade is, but we will fix it....."
1011422555947712513,Thank you South Carolina. Now let’s get out tomorrow and VOTE for @HenryMcMaster! https://t.co/5xlz0wfMfu
1011394762979586049,Just landed in South Carolina - will be at the McMaster rally shortly! #MAGA
1011391230188457984,"The hearing of Peter Strzok and the other hating frauds at the FBI &amp; DOJ should be shown to the public on live television, not a closed door hearing that nobody will see. We should expose these people for what they are - there should be total transparency!"
1011389124475961345,"Why is Senator Mark Warner (D-VA), perhaps in a near drunken state, claiming he has information that only he and Bob Mueller, the leader of the 13 Angry Democrats on a Witch Hunt, knows? Isn’t this highly illegal. Is it being investigated?"
1011385283562967041,“Director David Lynch: Trump Could Go Down as One of the Greatest Presidents” https://t.co/AcgnIZNh6e
1011360410648416258,"Surprised that Harley-Davidson, of all companies, would be the first to wave the White Flag. I fought hard for them and ultimately they will not pay tariffs selling into the E.U., which has hurt us badly on trade, down $151 Billion. Taxes just a Harley excuse - be patient!  #MAGA"
1011295779422695424,"Congresswoman Maxine Waters, an extraordinarily low IQ person, has become, together with Nancy Pelosi, the Face of the Democrat Party. She has just called for harm to supporters, of which there are many, of the Make America Great Again movement. Be careful what you wish for Max!"
1011256862975676416,"Will be heading to one of my favorite places, South Carolina, to fight for one of my original “fighters,” Governor Henry McMaster. Speaking at 7:00 P.M."
1011231137233080321,"....If this is done, illegal immigration will be stopped in it’s tracks - and at very little, by comparison, cost. This is the only real answer - and we must continue to BUILD THE WALL!"
1011228265003077632,"Hiring manythousands of judges, and going through a long and complicated legal process, is not the way to go - will always be disfunctional. People must simply be stopped at the Border and told they cannot come into the U.S. illegally. Children brought back to their country......"
1011226622324887556,"Such a difference in the media coverage of the same immigration policies between the Obama Administration and ours. Actually, we have done a far better job in that our facilities are cleaner and better run than were the facilities under Obama. Fake News is working overtime!"
1011218033216512005,"I have tried to stay uninvolved with the Department of Justice and FBI (although I do not legally have to), because of the now totally discredited and very expensive Witch Hunt currently going on. But you do have to ask why the DOJ &amp; FBI aren’t giving over requested documents?"
1011212766487728133,"The Red Hen Restaurant should focus more on cleaning its filthy canopies, doors and windows (badly needs a paint job) rather than refusing to serve a fine person like Sarah Huckabee Sanders. I always had a rule, if a restaurant is dirty on the outside, it is dirty on the inside!"
1011209592670425088,"Former Attorney General Michael Mukasey said that President Trump is probably correct that there was surveillance on Trump Tower. Actually, far greater than would ever have been believed!"
1011053439575576576,".@RepClayHiggins has been a great help to me on Cutting Taxes, creating great new healthcare programs at low cost, fighting for Border Security, our Military and are Vets. He is tough on Crime and has my full Endorsement. The Great State of Louisiana, we want Clay!"
1011038477889175553,"House Republicans could easily pass a Bill on Strong Border Security but remember, it still has to pass in the Senate, and for that we need 10 Democrat votes, and all they do is RESIST. They want Open Borders and don’t care about Crime! Need more Republicans to WIN in November!"
1011036519812030467,".@jimmyfallon is now whimpering to all that he did the famous “hair show” with me (where he seriously messed up my hair), &amp; that he would have now done it differently because it is said to have “humanized” me-he is taking heat. He called &amp; said “monster ratings.” Be a man Jimmy!"
1010978975391322112,"The United States is insisting that all countries that have placed artificial Trade Barriers and Tariffs on goods going into their country, remove those Barriers &amp; Tariffs or be met with more than Reciprocity by the U.S.A. Trade must be fair and no longer a one way street!"
1010902506422046721,"....Our Immigration policy, laughed at all over the world, is very unfair to all of those people who have gone through the system legally and are waiting on line for years! Immigration must be based on merit - we need people who will help to Make America Great Again!"
1010900865602019329,"We cannot allow all of these people to invade our Country. When somebody comes in, we must immediately, with no Judges or Court Cases, bring them back from where they came. Our system is a mockery to good immigration policy and Law and Order. Most children come without parents..."
1010873383087636480,"Democrats, fix the laws. Don’t RESIST. We are doing a far better job than Bush and Obama, but we need strength and security at the Border! Cannot accept all of the people trying to break into our Country. Strong Borders, No Crime!"
1010699954157830144,"Major Wall Street Journal opinion piece today talking about the Russian Witch Hunt and the disgrace that it is. So many people hurt, so bad for our country - a total sham!
https://t.co/bcpSGtoX6a"
1010619779600642048,Thank you @NVGOP! #MAGA https://t.co/OGTR2j6PGG
1010569562138406912,"It’s very sad that Nancy Pelosi and her sidekick, Cryin’ Chuck Schumer, want to protect illegal immigrants far more than the citizens of our country. The United States cannot stand for this. We wants safety and security at our borders!"
1010567610352611328,"Heading to Nevada to talk trade and immigration with supporters. Country’s economy is stronger than ever before with numbers that are getting better by the week. Tremendous potential, and trade deals are coming along well."
1010536329766006784,"My thoughts and prayers are with Representative Katie Arrington of South Carolina, including all of those involved in last nights car accident, and their families. https://t.co/rWYt2VBjxc"
1010522945402224642,"...everyone how much he likes me, but he will only vote with Nancy Pelosi. Keith is strong on borders and tough on crime — and loves cutting taxes! #MAGA"
1010522933498806278,".@VP Pence is heading to Pittsburgh, Pennsylvania where we have both strongly endorsed one of the finest men around, Congressman Keith @RothfusForPA. He is running against #LambTheSham, who is telling..."
1010505990259855361,"Drudge Report  “OBAMA KEPT THEM IN CAGES, WRAPPED THEM IN FOIL” We do a much better job while at the same time maintaining a MUCH stronger Border! Mainstream Fake Media hates this story."
1010503423773507584,“Disability applications plunge as economy strengthens”  Failing New York Times
1010502249263624195,The National Association of Manufacturers just announced that 95.1% of Manufacturers “have a positive outlook for their companies.”  This is the best number in the Association’s history!
1010486772541816834,The Russian Witch Hunt is Rigged!
1010485876806348800,".@FoxNews  Poll numbers plummet on the Democrat inspired and paid for Russian Witch Hunt. With all of the bias, lying and hate by the investigators, people want the investigators investigated. Much more will come out. A total scam and excuse for the Dems losing the Election!"
1010481479279923201,Steel is coming back fast! U.S. Steel is adding great capacity also. So are others. https://t.co/0Pzwjg3Vxn
1010320166486454272,"Based on the Tariffs and Trade Barriers long placed on the U.S. &amp; its great companies and workers by the European Union, if these Tariffs and Barriers are not soon broken down and removed, we will be placing a 20% Tariff on all of their cars coming into the U.S. Build them here!"
1010246126820347906,We are gathered today to hear directly from the AMERICAN VICTIMS of ILLEGAL IMMIGRATION. These are the American Citizens permanently separated from their loved ones b/c they were killed by criminal illegal aliens. These are the families the media ignores...https://t.co/ZjXESYAcjY
